{
 "schema_version": 2,
 "sku": "KEYCAP-MX-WJP",
 "name": "Artisan keycap: 19th hole (Cherry MX)",
 "family": "keycap",
 "kind": "personalised",
 "parents": [
  "TPL-KEYCAP-MX"
 ],
 "geometry": {
  "units": "mm",
  "dims_mm": [
   18.0,
   18.0,
   16.2
  ],
  "volume_cm3": 1.05,
  "faces": null,
  "shells": 1,
  "size_variants_mm": [],
  "locked_features": [
   {
    "id": "stem",
    "note": "Cherry MX cross 4.15 x 1.32, 4.6 deep"
   }
  ],
  "source": {}
 },
 "manufacture": {
  "supplier": "jlc3dp",
  "process": "wjp",
  "material": "Full Color Resin",
  "finish": "Oil Spraying (clear gloss)",
  "colour": "Multicolor (texture)",
  "hand_finish": [],
  "fulfilment": "dropship",
  "print_file": {
   "path": null,
   "sha256": null,
   "format": "obj-mtl-png-zip"
  },
  "preflight": {
   "report": "print/preflight.json",
   "acknowledged": {}
  },
  "supplier_settings": {},
  "lead_time_days": {
   "build": 5,
   "ship_min": 8,
   "ship_max": 13
  }
 },
 "cost": {
  "currency": "USD",
  "print": {
   "amount": 6.91,
   "basis": "estimate",
   "ref": "volume x preflight rate",
   "date": "2026-10-10"
  },
  "shipping": {
   "amount": 6.05,
   "basis": "estimate",
   "ref": "JLC quote 2026-10-09 for brick figures (US Global Standard); not quoted for this product",
   "date": "2026-10-09",
   "region": "US"
  },
  "packaging": {
   "amount": 0,
   "basis": "estimate",
   "ref": null,
   "date": null
  }
 },
 "slots": [
  {
   "id": "name",
   "type": "text",
   "label": "Name",
   "required": true,
   "offered": true,
   "validated": false,
   "evidence": null,
   "surface": {
    "kind": "planar",
    "anchor": "name plate"
   },
   "method": "relief",
   "text": {
    "font": "Fraunces-SemiBold",
    "cap_mm": 3.0,
    "min_cap_mm": 1.5,
    "max_chars": 10,
    "charset": "A-Z 0-9 '&-.!",
    "fit": "shrink-then-fallback-then-error"
   },
   "profile_source": [
    "subject.display_name"
   ]
  }
 ],
 "audience": {
  "suits": [
   "mechanical keyboard fans",
   "golfers who work at a desk",
   "gamers"
  ],
  "occasions": [
   "birthday",
   "Christmas stocking"
  ],
  "interests": [
   "keyboards",
   "golf"
  ],
  "relationship_to_buyer": [
   "partner",
   "friend",
   "dad"
  ],
  "not_for": [
   "low-profile or non-MX switches"
  ],
  "price_band": null,
  "tone": [
   "playful"
  ]
 },
 "listing": {
  "title": "Personalised Artisan Keycap, Golf 19th Hole Keycap, Custom Name Cherry MX Keycap, Mechanical Keyboard Gift, Golfer Gift",
  "price": {
   "currency": "GBP",
   "amount": 15.0
  },
  "tags": [
   "artisan keycap",
   "custom keycap",
   "cherry mx keycap",
   "golf keycap",
   "mechanical keyboard",
   "keyboard gift",
   "personalised keycap",
   "gamer gift",
   "desk gift",
   "golfer gift",
   "escape keycap",
   "keycap gift",
   "gift for dad"
  ],
  "materials": [
   "full colour resin"
  ],
  "short": "",
  "description": "The 19th hole on your Esc key: a tiny putting green with flag and ball, the name printed on the front. Female cross socket fits Cherry MX-style switches (4.15 × 1.32 mm, 4.6 mm deep).\n\nFull-colour resin, printed in one piece.\n\nPersonalisation: tell us the name (up to 10 letters) and, for photo pieces, send 1-3 clear front-facing photos after ordering.",
  "spec_rows": [
   [
    "Size",
    "18 × 18 × 16 mm"
   ],
   [
    "Material",
    "Full-colour resin (WJP)"
   ],
   [
    "Fits",
    "Cherry MX and clones"
   ],
   [
    "Personalised",
    "Name on front"
   ]
  ],
  "processing": "Made to order: 5-8 working days production, then shipping",
  "channels": [
   "etsy",
   "oddhobb-store"
  ],
  "images": [
   {
    "file": "01_hero.png",
    "role": "hero",
    "alt": "Golf green artisan keycap, hero"
   },
   {
    "file": "02_34.png",
    "role": "view",
    "alt": "Golf green artisan keycap, 34"
   },
   {
    "file": "03_front.png",
    "role": "view",
    "alt": "Golf green artisan keycap, front"
   },
   {
    "file": "04_side.png",
    "role": "view",
    "alt": "Golf green artisan keycap, side"
   },
   {
    "file": "05_spec.png",
    "role": "spec",
    "alt": "Golf green artisan keycap, spec"
   }
  ]
 },
 "assets": {
  "design_parts": "etsy_samples/out/p06_keycap/",
  "generator": "etsy_samples/g06_*.py",
  "listing_source": "etsy_samples/listings/p06_keycap"
 },
 "graph": {
  "related": [],
  "extends_to": []
 },
 "samples": [],
 "ext": {
  "listing_images_note": "rendered in Blender from the design-part OBJs (etsy_samples/r0N_*.py), NOT from the print file; re-render from print/ and register to pass G11",
  "blocker": "multi-part colour design; WJP needs ONE textured OBJ+MTL+PNG (bake part colours into the subject atlas)"
 }
}