{
 "schema_version": 2,
 "sku": "KEYCHAIN-BUST-WJP",
 "name": "Mini-me bust keychain from photos",
 "family": "keychain",
 "kind": "personalised",
 "parents": [
  "TPL-KEYCHAIN"
 ],
 "geometry": {
  "units": "mm",
  "dims_mm": null,
  "volume_cm3": null,
  "faces": null,
  "shells": null,
  "size_variants_mm": [],
  "locked_features": [
   {
    "id": "loop",
    "note": "printed loop, 4.0 mm ring hole"
   }
  ],
  "source": {}
 },
 "manufacture": {
  "supplier": "jlc3dp",
  "process": "wjp",
  "material": "Full Color Resin",
  "finish": "Oil Spraying (clear gloss)",
  "colour": "Multicolor (texture)",
  "hand_finish": [],
  "fulfilment": "dropship",
  "print_file": {
   "path": null,
   "sha256": null,
   "format": "obj-mtl-png-zip"
  },
  "preflight": {
   "report": "print/preflight.json",
   "acknowledged": {}
  },
  "supplier_settings": {},
  "lead_time_days": {
   "build": 5,
   "ship_min": 8,
   "ship_max": 13
  }
 },
 "cost": {
  "currency": "USD",
  "print": {
   "amount": null,
   "basis": "estimate",
   "ref": "volume x preflight rate",
   "date": "2026-10-10"
  },
  "shipping": {
   "amount": 6.05,
   "basis": "estimate",
   "ref": "JLC quote 2026-10-09 for brick figures (US Global Standard); not quoted for this product",
   "date": "2026-10-09",
   "region": "US"
  },
  "packaging": {
   "amount": 0,
   "basis": "estimate",
   "ref": null,
   "date": null
  }
 },
 "slots": [
  {
   "id": "subject",
   "type": "mesh",
   "label": "Their mini-me (from photos)",
   "required": true,
   "offered": true,
   "validated": false,
   "evidence": null,
   "surface": {
    "kind": "whole-model"
   },
   "method": "subject-mesh"
  },
  {
   "id": "name",
   "type": "text",
   "label": "Name",
   "required": true,
   "offered": true,
   "validated": false,
   "evidence": null,
   "surface": {
    "kind": "planar",
    "anchor": "name plate"
   },
   "method": "relief",
   "text": {
    "font": "Fraunces-SemiBold",
    "cap_mm": 3.0,
    "min_cap_mm": 1.5,
    "max_chars": 10,
    "charset": "A-Z 0-9 '&-.!",
    "fit": "shrink-then-fallback-then-error"
   },
   "profile_source": [
    "subject.display_name"
   ]
  }
 ],
 "audience": {
  "suits": [
   "people who love a mini-me",
   "dads",
   "new drivers"
  ],
  "occasions": [
   "birthday",
   "Father's Day",
   "Christmas stocking"
  ],
  "interests": [
   "mini-me"
  ],
  "relationship_to_buyer": [
   "dad",
   "grandad",
   "partner",
   "friend"
  ],
  "not_for": [
   "children under 3 (small parts)"
  ],
  "price_band": null,
  "tone": [
   "funny-affectionate"
  ]
 },
 "listing": {
  "title": "Personalised 3D Face Keychain, Custom Bust Keyring from Photo, Mini Me Keychain, Funny Gift for Dad, 3D Printed Portrait",
  "price": {
   "currency": "GBP",
   "amount": 15.0
  },
  "tags": [
   "3d face keychain",
   "custom keychain",
   "photo keychain",
   "mini me",
   "bust keyring",
   "personalised keyring",
   "funny dad gift",
   "3d portrait",
   "face keyring",
   "custom figure",
   "gift for him",
   "3d printed gift",
   "novelty keychain"
  ],
  "materials": [
   "full colour resin",
   "metal key ring"
  ],
  "short": "",
  "description": "A full-colour 3D bust built from their photos, on a name plate, with a printed loop for your key ring. 46 mm tall: small enough for keys, big enough to recognise.\n\nPersonalisation: tell us the name (up to 10 letters) and, for photo pieces, send 1-3 clear front-facing photos after ordering.",
  "spec_rows": [
   [
    "Size",
    "45 × 26 × 46 mm"
   ],
   [
    "Material",
    "Full-colour resin (WJP)"
   ],
   [
    "Ring hole",
    "4.0 mm printed loop"
   ],
   [
    "Personalised",
    "3D bust from photos + name plate"
   ]
  ],
  "processing": "Made to order: 5-8 working days production, then shipping",
  "channels": [
   "etsy",
   "oddhobb-store"
  ],
  "images": [
   {
    "file": "01_hero.png",
    "role": "hero",
    "alt": "Full-colour mini bust keychain, hero"
   },
   {
    "file": "02_34.png",
    "role": "view",
    "alt": "Full-colour mini bust keychain, 34"
   },
   {
    "file": "03_front.png",
    "role": "view",
    "alt": "Full-colour mini bust keychain, front"
   },
   {
    "file": "04_side.png",
    "role": "view",
    "alt": "Full-colour mini bust keychain, side"
   },
   {
    "file": "05_spec.png",
    "role": "spec",
    "alt": "Full-colour mini bust keychain, spec"
   }
  ]
 },
 "assets": {
  "design_parts": "etsy_samples/out/p08_keychain/",
  "generator": "etsy_samples/g08_*.py",
  "listing_source": "etsy_samples/listings/p08_keychain"
 },
 "graph": {
  "related": [],
  "extends_to": []
 },
 "samples": [],
 "ext": {
  "listing_images_note": "rendered in Blender from the design-part OBJs (etsy_samples/r0N_*.py), NOT from the print file; re-render from print/ and register to pass G11",
  "blocker": "multi-part colour design; WJP needs ONE textured OBJ+MTL+PNG (bake part colours into the subject atlas)"
 }
}