{
 "schema_version": 2,
 "sku": "FIG-MINI-GOLF-WJP",
 "name": "Mini-me desk figure on putting green",
 "family": "mini-figure",
 "kind": "personalised",
 "parents": [
  "TPL-MINI-FIG"
 ],
 "geometry": {
  "units": "mm",
  "dims_mm": null,
  "volume_cm3": null,
  "faces": null,
  "shells": null,
  "size_variants_mm": [],
  "locked_features": [
   {
    "id": "scale",
    "note": "75 mm class figure, 66 mm subject"
   }
  ],
  "source": {}
 },
 "manufacture": {
  "supplier": "jlc3dp",
  "process": "wjp",
  "material": "Full Color Resin",
  "finish": "Oil Spraying (clear gloss)",
  "colour": "Multicolor (texture)",
  "hand_finish": [],
  "fulfilment": "dropship",
  "print_file": {
   "path": null,
   "sha256": null,
   "format": "obj-mtl-png-zip"
  },
  "preflight": {
   "report": "print/preflight.json",
   "acknowledged": {}
  },
  "supplier_settings": {},
  "lead_time_days": {
   "build": 5,
   "ship_min": 8,
   "ship_max": 13
  }
 },
 "cost": {
  "currency": "USD",
  "print": {
   "amount": null,
   "basis": "estimate",
   "ref": "volume x preflight rate",
   "date": "2026-10-10"
  },
  "shipping": {
   "amount": 6.05,
   "basis": "estimate",
   "ref": "JLC quote 2026-10-09 for brick figures (US Global Standard); not quoted for this product",
   "date": "2026-10-09",
   "region": "US"
  },
  "packaging": {
   "amount": 0,
   "basis": "estimate",
   "ref": null,
   "date": null
  }
 },
 "slots": [
  {
   "id": "subject",
   "type": "mesh",
   "label": "Their mini-me (from photos)",
   "required": true,
   "offered": true,
   "validated": false,
   "evidence": null,
   "surface": {
    "kind": "whole-model"
   },
   "method": "subject-mesh"
  },
  {
   "id": "name",
   "type": "text",
   "label": "Name",
   "required": true,
   "offered": true,
   "validated": false,
   "evidence": null,
   "surface": {
    "kind": "planar",
    "anchor": "name plate"
   },
   "method": "relief",
   "text": {
    "font": "Fraunces-SemiBold",
    "cap_mm": 3.0,
    "min_cap_mm": 1.5,
    "max_chars": 10,
    "charset": "A-Z 0-9 '&-.!",
    "fit": "shrink-then-fallback-then-error"
   },
   "profile_source": [
    "subject.display_name"
   ]
  }
 ],
 "audience": {
  "suits": [
   "golfers",
   "dads who play off a terrible handicap",
   "people who have everything"
  ],
  "occasions": [
   "birthday",
   "retirement",
   "Father's Day",
   "Christmas"
  ],
  "interests": [
   "golf",
   "mini-me"
  ],
  "relationship_to_buyer": [
   "dad",
   "grandad",
   "partner",
   "friend"
  ],
  "not_for": [
   "children under 3 (small parts)"
  ],
  "price_band": null,
  "tone": [
   "funny-affectionate"
  ]
 },
 "listing": {
  "title": "Personalised 3D Mini Me Figure on Golf Green, Custom Photo Figurine, Golfer Desk Figure, Unique Gift for Dad Who Has Everything",
  "price": {
   "currency": "GBP",
   "amount": 24.99
  },
  "tags": [
   "mini me figure",
   "custom figurine",
   "3d figurine",
   "photo figurine",
   "golfer gift",
   "golf figurine",
   "desk figure",
   "gift for dad",
   "personalised figure",
   "3d portrait",
   "golf gift",
   "unique gift",
   "cake topper"
  ],
  "materials": [
   "full colour resin"
  ],
  "short": "",
  "description": "Them, 66 mm tall, standing on a putting green with the flag and ball, name on the plinth. Full-colour resin built from their photos.\n\nPersonalisation: tell us the name (up to 10 letters) and, for photo pieces, send 1-3 clear front-facing photos after ordering.",
  "spec_rows": [
   [
    "Size",
    "46 mm Ø × 73 mm"
   ],
   [
    "Material",
    "Full-colour resin (WJP)"
   ],
   [
    "Base",
    "Putting green with flag + ball"
   ],
   [
    "Personalised",
    "66 mm figure + name"
   ]
  ],
  "processing": "Made to order: 5-8 working days production, then shipping",
  "channels": [
   "etsy",
   "oddhobb-store"
  ],
  "images": [
   {
    "file": "01_hero.png",
    "role": "hero",
    "alt": "Full-colour mini-me golfer desk figure, hero"
   },
   {
    "file": "02_34.png",
    "role": "view",
    "alt": "Full-colour mini-me golfer desk figure, 34"
   },
   {
    "file": "03_front.png",
    "role": "view",
    "alt": "Full-colour mini-me golfer desk figure, front"
   },
   {
    "file": "04_side.png",
    "role": "view",
    "alt": "Full-colour mini-me golfer desk figure, side"
   },
   {
    "file": "05_spec.png",
    "role": "spec",
    "alt": "Full-colour mini-me golfer desk figure, spec"
   }
  ]
 },
 "assets": {
  "design_parts": "etsy_samples/out/p10_mini_figure/",
  "generator": "",
  "listing_source": "etsy_samples/listings/p10_mini_figure"
 },
 "graph": {
  "related": [],
  "extends_to": []
 },
 "samples": [],
 "ext": {
  "listing_images_note": "rendered in Blender from the design-part OBJs (etsy_samples/r0N_*.py), NOT from the print file; re-render from print/ and register to pass G11",
  "blocker": "multi-part colour design; WJP needs ONE textured OBJ+MTL+PNG (bake part colours into the subject atlas)"
 }
}