{
 "schema_version": 2,
 "sku": "CHARM-CROC-PET",
 "name": "Croc charm: pet head",
 "family": "croc-charm",
 "kind": "personalised",
 "parents": [
  "TPL-CROC-G07"
 ],
 "geometry": {
  "units": "mm",
  "dims_mm": [
   15.62,
   16.0,
   22.3
  ],
  "volume_cm3": 1.6,
  "faces": null,
  "shells": 1,
  "size_variants_mm": [],
  "locked_features": [
   {
    "id": "stem",
    "note": "4.2 mm stem + 6.8 mm stopper (Crocs hole fit); never change"
   },
   {
    "id": "face_max",
    "note": "face <= 26 mm for this line"
   }
  ],
  "source": {}
 },
 "manufacture": {
  "supplier": "jlc3dp",
  "process": "wjp-tough",
  "material": "Full Color Tough Resin",
  "finish": "Oil Spraying (clear gloss)",
  "colour": "Multicolor (texture)",
  "hand_finish": [],
  "fulfilment": "dropship",
  "print_file": {
   "path": "print/CHARM-CROC-PET-wjp-tough.zip",
   "sha256": "85bab4062388c6fca151e4b3249ef323a4830d43ef47c97d17a24be3eafd0797",
   "format": "obj-mtl-png-zip"
  },
  "preflight": {
   "report": "print/preflight.json",
   "acknowledged": {}
  },
  "supplier_settings": {},
  "lead_time_days": {
   "build": 5,
   "ship_min": 8,
   "ship_max": 13
  }
 },
 "cost": {
  "currency": "USD",
  "print": {
   "amount": 6.91,
   "basis": "estimate",
   "ref": "JLC WJP floor price seen 2026-10-09",
   "date": "2026-10-09"
  },
  "shipping": {
   "amount": 6.05,
   "basis": "estimate",
   "ref": "JLC quote 2026-10-09 for brick figures (US Global Standard); not quoted for this product",
   "date": "2026-10-09",
   "region": "US"
  },
  "packaging": {
   "amount": 0,
   "basis": "estimate",
   "ref": null,
   "date": null
  }
 },
 "slots": [
  {
   "id": "subject",
   "type": "mesh",
   "label": "Your face / pet",
   "required": true,
   "offered": true,
   "validated": false,
   "evidence": null,
   "surface": {
    "kind": "whole-model"
   },
   "method": "subject-mesh",
   "preview": "mesh-render"
  }
 ],
 "audience": {
  "suits": [
   "dog owners",
   "croc wearers",
   "gift buyers"
  ],
  "occasions": [
   "Christmas stocking",
   "birthday"
  ],
  "interests": [
   "dogs",
   "crocs",
   "personalised gifts"
  ],
  "relationship_to_buyer": [
   "for pet lovers"
  ],
  "not_for": [
   "children under 3 (small parts)"
  ],
  "price_band": "impulse",
  "tone": [
   "fun",
   "heartfelt"
  ]
 },
 "listing": {
  "title": "Personalised Pet Croc Charm | Custom Dog Face Jibbitz | Pet Shoe Charm | Dog Lover Gift",
  "price": {
   "currency": "GBP",
   "amount": null
  },
  "tags": [
   "pet croc charm",
   "dog jibbitz",
   "custom shoe charm",
   "pet face charm",
   "dog lover gift",
   "personalised crocs",
   "croc charm custom",
   "pet memorial gift",
   "funny dog gift",
   "stocking filler",
   "clog charm",
   "pet portrait gift",
   "dog mum gift"
  ],
  "materials": [
   "Full-colour resin print (WJP)",
   "Gloss protective coat",
   "Croc-compatible pin stem"
  ],
  "short": "Your pet\u2019s head, printed in full colour for your Crocs.",
  "description": "Cliptheir favourite face onto their favourite shoes. Send us one clear photo of your pet and we sculpt a miniature glossy portrait head, printed in full colour with a sturdy Croc-compatible pin stem on the back. Each charm is made to order from your photo: big eyes, floppy ears, that exact expression. Fits standard clog ventilation holes, wipes clean with a damp cloth, and survives rain, mud and playground duty. A perfect stocking filler for dog mums, dads and anyone whose personality is 90 percent pet.",
  "spec_rows": [
   [
    "Size",
    "Approx 28 mm tall portrait head"
   ],
   [
    "Fitting",
    "Standard clog-hole pin stem, push-fit"
   ],
   [
    "Material",
    "Full-colour resin print, gloss coated"
   ]
  ],
  "processing": "Made to order in 3-5 working days, then posted tracked.",
  "channels": [
   "etsy",
   "oddhobb-store"
  ],
  "images": [
   {
    "file": "crocpet_hero.png",
    "role": "hero",
    "alt": "Personalised pet-head croc charm, glossy full-colour 3D print, front three-quarter view"
   },
   {
    "file": "crocpet_front.png",
    "role": "view",
    "alt": "Croc charm front view showing pet face and collar detail"
   },
   {
    "file": "crocpet_side.png",
    "role": "view",
    "alt": "Croc charm side view showing charm depth and pin stem"
   },
   {
    "file": "crocpet_back.png",
    "role": "view",
    "alt": "Croc charm back view with clog pin fitting"
   },
   {
    "file": "crocpet_detail.png",
    "role": "detail",
    "alt": "Close-up of pet face print detail on the croc charm"
   }
  ]
 },
 "assets": {},
 "graph": {
  "related": [],
  "extends_to": [
   "golf, footy and pet charm sets"
  ]
 },
 "samples": [],
 "ext": {}
}