{
 "schema_version": 2,
 "sku": "FIG-PETBIG-TUX-80",
 "name": "Me & My Big Pet custom figurine, 80 mm (tuxedo cat sample)",
 "family": "figure-with-pet",
 "kind": "personalised",
 "parents": [
  "TPL-FIG-PETBIG"
 ],
 "geometry": {
  "units": "mm",
  "dims_mm": [
   61.74,
   58.76,
   79.99
  ],
  "volume_cm3": 71.4,
  "faces": 149822,
  "shells": 1,
  "size_variants_mm": [
   60,
   80,
   100
  ],
  "locked_features": [
   {
    "id": "base_disc",
    "kind": "plinth",
    "note": "round black base ~58 mm, flat underside = stability; never cut or text-engrave its underside"
   },
   {
    "id": "scale_ratio",
    "kind": "composition",
    "note": "pet oversized (~1.8x person). The joke of the product; keep it"
   }
  ],
  "source": {
   "generator": "meshy",
   "file": "files/uploads/Meshy_AI_me_and_my_big_pet_fig_1010081949_image-to-3d-texture.glb",
   "template": "Meshy 'me and my big pet' image-to-3D"
  }
 },
 "manufacture": {
  "supplier": "jlc3dp",
  "process": "wjp",
  "material": "Full Color Resin",
  "finish": "Oil Spraying (clear gloss)",
  "colour": "Multicolor (texture)",
  "hand_finish": [],
  "fulfilment": "dropship",
  "print_file": {
   "path": "print/FIG-PETBIG-TUX-80-wjp.zip",
   "sha256": "18f75b31ac53cfb808db4e85486ded0688abe43133f654a96ab540ce8d2c9014",
   "format": "obj-mtl-png-zip"
  },
  "preflight": {
   "report": "print/preflight.json",
   "acknowledged": {
    "zip size": "8.5 MB; upload it, fall back to a 4k texture if JLC's uploader rejects it",
    "thin walls < 0.8 mm": "whiskers/ear edges; tick the thin-wall risk box (JLC flags every figure)",
    "self-intersections": "person touches cat; WJP fuses overlapping shells"
   }
  },
  "supplier_settings": {
   "process": "WJP(Resin)",
   "material": "Full Color Resin",
   "colour": "Multicolor (check MTL tag)",
   "qty": 1,
   "thin_wall_risk_box": "tick",
   "packaging": "Blank Box"
  },
  "lead_time_days": {
   "build": 5,
   "ship_min": 8,
   "ship_max": 13
  }
 },
 "cost": {
  "currency": "USD",
  "print": {
   "amount": 58.58,
   "basis": "estimate",
   "ref": "preflight volume x $0.82/cm3 (2026-10-09 size sweep)",
   "date": "2026-10-10"
  },
  "shipping": {
   "amount": 6.05,
   "basis": "estimate",
   "ref": "JLC quote 2026-10-09 for brick figures (US Global Standard); not quoted for this product",
   "date": "2026-10-09",
   "region": "US"
  },
  "packaging": {
   "amount": 0,
   "basis": "estimate",
   "ref": null,
   "date": null
  }
 },
 "slots": [
  {
   "id": "subject",
   "type": "mesh",
   "label": "You + your pet",
   "required": true,
   "surface": {
    "kind": "whole-model"
   },
   "method": "subject-mesh",
   "mesh": {
    "subject_kind": "person+pet",
    "input": "1 photo of the person (full body) + 1-3 photos of the pet",
    "generator": "meshy image-to-3d (template: me and my big pet)",
    "cached_per": "order",
    "regen_cost_usd": null
   },
   "preview": "mesh-render",
   "offered": true,
   "validated": true,
   "evidence": "print/preflight.json",
   "ext": {}
  },
  {
   "id": "pet_name",
   "type": "text",
   "label": "Pet's name on the base rim",
   "required": false,
   "surface": {
    "kind": "uv-curved",
    "anchor": "base_disc.front_rim",
    "box_mm": [
     40,
     4
    ]
   },
   "method": "texture-paint",
   "text": {
    "font": "Fraunces",
    "cap_mm": 3.0,
    "min_cap_mm": 2.0,
    "max_chars": 14,
    "min_chars": 1,
    "lines": 1,
    "charset": "A-Z a-z 0-9 '&-.",
    "relief_mm": 0,
    "fit": "shrink-then-fallback-then-error"
   },
   "profile_source": [
    "pet_name"
   ],
   "fallback_source": [
    "pet_initial"
   ],
   "preview": "plate-uv",
   "offered": false,
   "validated": false,
   "evidence": null
  },
  {
   "id": "base_colour",
   "type": "colour",
   "label": "Base colour",
   "required": false,
   "surface": {
    "kind": "material",
    "anchor": "base_disc"
   },
   "method": "texture-paint",
   "colour": {
    "palette": [
     "#111111 gloss black",
     "#F4F1EA bone",
     "#1F3A5F navy",
     "#EE7410 OddHobb orange"
    ],
    "default": "#111111 gloss black"
   },
   "preview": "plate-uv",
   "offered": false,
   "validated": false,
   "evidence": null
  }
 ],
 "audience": {
  "suits": [
   "cat or dog owners who joke their pet runs the house",
   "people who post their pet more than themselves",
   "new pet parents",
   "someone who just lost a pet (memorial version, softer copy)"
  ],
  "occasions": [
   "birthday",
   "Christmas",
   "gotcha day",
   "pet memorial",
   "moving in together",
   "Mother's/Father's Day from the pet"
  ],
  "interests": [
   "pets",
   "cute collectibles",
   "desk decor"
  ],
  "relationship_to_buyer": [
   "partner",
   "sister/brother",
   "best friend",
   "mum/dad",
   "self-gift"
  ],
  "not_for": [
   "buyers wanting photoreal portrait likeness (it's stylised)",
   "kids under 3 (small parts, resin)",
   "outdoor display (UV fade)"
  ],
  "price_band": "premium £40-90",
  "tone": [
   "cute",
   "funny-affectionate"
  ]
 },
 "listing": {
  "title": "Custom Pet & Owner Figurine, Me and My Big Pet, Personalised Full Colour 3D Printed Cat or Dog Statue from Photo, Pet Lover Gift",
  "price": {
   "currency": "GBP",
   "amount": null
  },
  "tags": [
   "custom pet figurine",
   "pet and owner gift",
   "cat statue custom",
   "dog figurine photo",
   "pet portrait 3d",
   "personalised pet",
   "cat mum gift",
   "dog dad gift",
   "pet memorial gift",
   "3d printed figure",
   "custom cat figure",
   "gift for pet lover",
   "mini me figurine"
  ],
  "materials": [
   "full colour resin",
   "clear gloss coat"
  ],
  "short": "You, tiny. Your pet, enormous. Hand-finished full-colour 3D figurine made from your photos.",
  "description": "Send us a photo of you and your pet and we sculpt you both: you at normal size, your pet as the giant they think they are. Printed in full-colour resin with a clear gloss coat, on a round display base.\n\nHow it works: order, then send one full-body photo of you and 1-3 clear photos of your pet. We sculpt both, send you a preview, and print once you approve. Each piece is printed in full-colour resin, so the colour runs through the model, then clear-coated.",
  "spec_rows": [
   [
    "Height",
    "80 mm (60/100 mm options)"
   ],
   [
    "Base",
    "58 mm round"
   ],
   [
    "Material",
    "Full-colour resin, gloss coat"
   ],
   [
    "Made from",
    "Your photos (1 of you, 1-3 of your pet)"
   ],
   [
    "Production",
    "about 5 days + shipping"
   ]
  ],
  "processing": "Made to order: preview in 2-3 days, then about 5 days production plus shipping",
  "channels": [
   "etsy",
   "oddhobb-store"
  ],
  "images": [
   {
    "file": "bigpet_hero.png",
    "role": "hero",
    "alt": "Full-colour figurine of a woman holding a giant tuxedo cat, three-quarter view"
   },
   {
    "file": "bigpet_front.png",
    "role": "view",
    "alt": "Front view of the pet and owner figurine"
   },
   {
    "file": "bigpet_side.png",
    "role": "view",
    "alt": "Side view showing the oversized cat"
   },
   {
    "file": "bigpet_back.png",
    "role": "view",
    "alt": "Back view of the figurine on its round base"
   }
  ]
 },
 "assets": {
  "master": "files/uploads/Meshy_AI_me_and_my_big_pet_fig_1010081949_image-to-3d-texture.glb",
  "work_dir": "pipeline/work/bigpet/h80",
  "excluded_images": {
   "bigpet_detail.png": "misframed (chin crop); re-render before use"
  }
 },
 "graph": {
  "related": [
   {
    "sku": "CHARM-CROC-PET",
    "rel": "same-subject-smaller"
   }
  ],
  "extends_to": [
   "size 60/100 mm variants",
   "dog version",
   "memorial copy"
  ]
 },
 "samples": [],
 "ext": {}
}