{
 "schema_version": 2,
 "sku": "PEGS-CRIB-316L",
 "name": "Cribbage pegs: golf-ball + flag set, engraved",
 "family": "cribbage-pegs",
 "kind": "personalised",
 "parents": [
  "TPL-CRIB-PEG"
 ],
 "geometry": {
  "units": "mm",
  "dims_mm": [
   8.6,
   8.6,
   29.7
  ],
  "volume_cm3": 0.55,
  "faces": null,
  "shells": 1,
  "size_variants_mm": [],
  "locked_features": [
   {
    "id": "shaft",
    "note": "3.1 mm x 14 mm shaft (1/8\" holes)"
   }
  ],
  "source": {}
 },
 "manufacture": {
  "supplier": "jlc3dp",
  "process": "slm-316l",
  "material": "316L stainless steel",
  "finish": "polished",
  "colour": "steel",
  "hand_finish": [],
  "fulfilment": "dropship",
  "print_file": {
   "path": "print/PEGS-CRIB-316L-slm-316l.zip",
   "sha256": "b3e1723b12294a609bc30ea8c53f2e0295cdae01f382eaadcf2bdc7423c5bf7d",
   "format": "mesh-zip"
  },
  "preflight": {
   "report": "print/preflight.json",
   "acknowledged": {}
  },
  "supplier_settings": {},
  "lead_time_days": {
   "build": null,
   "ship_min": null,
   "ship_max": null
  }
 },
 "cost": {
  "currency": "USD",
  "print": {
   "amount": null,
   "basis": null,
   "ref": null,
   "date": null
  },
  "shipping": {
   "amount": 6.05,
   "basis": "estimate",
   "ref": "JLC quote 2026-10-09 for brick figures (US Global Standard); not quoted for this product",
   "date": "2026-10-09",
   "region": "US"
  },
  "packaging": {
   "amount": 0,
   "basis": "estimate",
   "ref": null,
   "date": null
  }
 },
 "slots": [
  {
   "id": "initials",
   "type": "text",
   "label": "Initials (flag)",
   "required": false,
   "offered": true,
   "validated": false,
   "evidence": null,
   "surface": {
    "kind": "planar",
    "anchor": "flag face"
   },
   "method": "relief",
   "text": {
    "font": "Fraunces-SemiBold",
    "cap_mm": 2.0,
    "min_cap_mm": 2.0,
    "max_chars": 3,
    "charset": "A-Z 0-9 '&-.!",
    "fit": "shrink-then-fallback-then-error"
   },
   "profile_source": []
  }
 ],
 "audience": {
  "suits": [
   "cribbage players",
   "golfers who play crib",
   "collectors of game pieces"
  ],
  "occasions": [
   "birthday",
   "Christmas"
  ],
  "interests": [
   "cribbage",
   "golf"
  ],
  "relationship_to_buyer": [
   "dad",
   "grandad",
   "partner",
   "friend"
  ],
  "not_for": [
   "children under 3 (small parts)"
  ],
  "price_band": null,
  "tone": [
   "funny-affectionate"
  ]
 },
 "listing": {
  "title": "Personalised Cribbage Pegs, Stainless Steel Golf Ball Pegs, Engraved Initials, Custom Cribbage Board Pegs, Gift for Cribbage Player",
  "price": {
   "currency": "GBP",
   "amount": 15.0
  },
  "tags": [
   "cribbage pegs",
   "custom cribbage",
   "metal cribbage pegs",
   "golf cribbage",
   "cribbage gift",
   "engraved pegs",
   "stainless pegs",
   "cribbage board",
   "gift for grandpa",
   "card game gift",
   "golf gift",
   "initials gift",
   "game pieces"
  ],
  "materials": [
   "316L stainless steel"
  ],
  "short": "",
  "description": "A golf-ball peg and a flag peg in solid polished 316L stainless, engraved with initials. Shafts are 3.1 mm × 14 mm to fit standard 1/8\" cribbage holes.\n\nSold as a pair.\n\nPersonalisation: tell us the name (up to 10 letters) and, for photo pieces, send 1-3 clear front-facing photos after ordering.",
  "spec_rows": [
   [
    "Size",
    "8.6 mm Ø × 29.7 mm"
   ],
   [
    "Material",
    "316L stainless steel"
   ],
   [
    "Finish",
    "Polished"
   ],
   [
    "Fits",
    "Standard 1/8\" (3.1 mm) holes"
   ]
  ],
  "processing": "Made to order: 5-8 working days production, then shipping",
  "channels": [
   "etsy",
   "oddhobb-store"
  ],
  "images": [
   {
    "file": "01_hero.png",
    "role": "hero",
    "alt": "Steel cribbage pegs shaped like golf balls and flags, hero"
   },
   {
    "file": "02_34.png",
    "role": "view",
    "alt": "Steel cribbage pegs shaped like golf balls and flags, 34"
   },
   {
    "file": "03_front.png",
    "role": "view",
    "alt": "Steel cribbage pegs shaped like golf balls and flags, front"
   },
   {
    "file": "04_side.png",
    "role": "view",
    "alt": "Steel cribbage pegs shaped like golf balls and flags, side"
   },
   {
    "file": "05_spec.png",
    "role": "spec",
    "alt": "Steel cribbage pegs shaped like golf balls and flags, spec"
   }
  ]
 },
 "assets": {
  "design_parts": "etsy_samples/out/p05_cribbage_pegs/",
  "generator": "etsy_samples/g05_*.py",
  "listing_source": "etsy_samples/listings/p05_cribbage_pegs"
 },
 "graph": {
  "related": [],
  "extends_to": []
 },
 "samples": [],
 "ext": {
  "listing_images_note": "rendered in Blender from the design-part OBJs (etsy_samples/r0N_*.py), NOT from the print file; re-render from print/ and register to pass G11",
  "blocker": "two parts in one zip; JLC needs one model per line item (split into two print files or one merged body)"
 }
}