{
 "schema_version": 2,
 "sku": "MARKER-GOLF-CNC",
 "name": "Personalised golf ball marker, black anodised aluminium",
 "family": "golf-marker",
 "kind": "personalised",
 "parents": [
  "TPL-GOLF-MARKER"
 ],
 "geometry": {
  "units": "mm",
  "dims_mm": [
   24.0,
   24.0,
   2.0
  ],
  "volume_cm3": 0.826,
  "faces": null,
  "shells": 1,
  "size_variants_mm": [],
  "locked_features": [
   {
    "id": "disc",
    "note": "24 mm dia x 2.0 mm (marker standard)"
   }
  ],
  "source": {}
 },
 "manufacture": {
  "supplier": "jlc3dp",
  "process": "cnc",
  "material": "6061 aluminium",
  "finish": "black anodise + laser mark both faces",
  "colour": "black",
  "hand_finish": [],
  "fulfilment": "dropship",
  "print_file": {
   "path": null,
   "sha256": null,
   "format": "step-zip"
  },
  "preflight": {
   "report": "print/preflight.json",
   "acknowledged": {}
  },
  "supplier_settings": {},
  "lead_time_days": {
   "build": null,
   "ship_min": null,
   "ship_max": null
  }
 },
 "cost": {
  "currency": "USD",
  "print": {
   "amount": null,
   "basis": null,
   "ref": null,
   "date": null
  },
  "shipping": {
   "amount": 6.05,
   "basis": "estimate",
   "ref": "JLC quote 2026-10-09 for brick figures (US Global Standard); not quoted for this product",
   "date": "2026-10-09",
   "region": "US"
  },
  "packaging": {
   "amount": 0,
   "basis": "estimate",
   "ref": null,
   "date": null
  }
 },
 "slots": [
  {
   "id": "name",
   "type": "text",
   "label": "Name (front)",
   "required": true,
   "offered": true,
   "validated": false,
   "evidence": null,
   "surface": {
    "kind": "planar",
    "anchor": "front ring"
   },
   "method": "relief",
   "text": {
    "font": "Fraunces-SemiBold",
    "cap_mm": 3.0,
    "min_cap_mm": 1.5,
    "max_chars": 10,
    "charset": "A-Z 0-9 '&-.!",
    "fit": "shrink-then-fallback-then-error"
   },
   "profile_source": [
    "subject.display_name"
   ]
  },
  {
   "id": "message",
   "type": "text",
   "label": "Message (back)",
   "required": false,
   "offered": true,
   "validated": false,
   "evidence": null,
   "surface": {
    "kind": "planar",
    "anchor": "back face"
   },
   "method": "relief",
   "text": {
    "font": "Fraunces-SemiBold",
    "cap_mm": 2.0,
    "min_cap_mm": 1.2,
    "max_chars": 24,
    "charset": "A-Z 0-9 '&-.!",
    "fit": "shrink-then-fallback-then-error"
   },
   "profile_source": []
  }
 ],
 "audience": {
  "suits": [
   "golfers",
   "dads who play off a terrible handicap",
   "people who have everything"
  ],
  "occasions": [
   "birthday",
   "Father's Day",
   "Christmas",
   "retirement"
  ],
  "interests": [
   "golf"
  ],
  "relationship_to_buyer": [
   "dad",
   "grandad",
   "partner",
   "friend"
  ],
  "not_for": [
   "children under 3 (small parts)"
  ],
  "price_band": null,
  "tone": [
   "funny-affectionate"
  ]
 },
 "listing": {
  "title": "Personalised Golf Ball Marker, Engraved Aluminium, Custom Name Golf Gift for Dad, Funny Golfer Christmas Gift, Par Is Optional",
  "price": {
   "currency": "GBP",
   "amount": 10.0
  },
  "tags": [
   "golf ball marker",
   "personalised golf",
   "golf gift for dad",
   "engraved marker",
   "custom ball marker",
   "golfer gift",
   "fathers day golf",
   "golf christmas gift",
   "aluminium marker",
   "funny golf gift",
   "golf accessories",
   "gift for golfer",
   "par is optional"
  ],
  "materials": [
   "6061 aluminium",
   "anodised finish"
  ],
  "short": "",
  "description": "Machined from solid 6061 aluminium, black anodised and laser engraved on both faces. Front: their name around a flag-and-hole icon with PAR IS OPTIONAL. Back: your own message (ours says LOVE, THE KIDS / XMAS 2026).\n\nStandard 24 mm marker size, 2 mm thick, flat enough for any hat clip or divot tool magnet.\n\nPersonalisation: tell us the name (up to 10 letters) and, for photo pieces, send 1-3 clear front-facing photos after ordering.",
  "spec_rows": [
   [
    "Size",
    "24 mm Ø × 2.0 mm"
   ],
   [
    "Material",
    "CNC 6061 aluminium"
   ],
   [
    "Finish",
    "Black anodised, laser engraved both sides"
   ],
   [
    "Personalised",
    "Name front, message back"
   ]
  ],
  "processing": "Made to order: 5-8 working days production, then shipping",
  "channels": [
   "etsy",
   "oddhobb-store"
  ],
  "images": [
   {
    "file": "01_hero.png",
    "role": "hero",
    "alt": "Engraved black aluminium golf ball marker, hero"
   },
   {
    "file": "02_high34.png",
    "role": "view",
    "alt": "Engraved black aluminium golf ball marker, high34"
   },
   {
    "file": "03_top.png",
    "role": "view",
    "alt": "Engraved black aluminium golf ball marker, top"
   },
   {
    "file": "04_under.png",
    "role": "view",
    "alt": "Engraved black aluminium golf ball marker, under"
   },
   {
    "file": "05_spec.png",
    "role": "spec",
    "alt": "Engraved black aluminium golf ball marker, spec"
   }
  ]
 },
 "assets": {
  "design_parts": "etsy_samples/out/p01_golf_marker/",
  "generator": "etsy_samples/g01_*.py",
  "listing_source": "etsy_samples/listings/p01_golf_marker"
 },
 "graph": {
  "related": [],
  "extends_to": []
 },
 "samples": [],
 "ext": {
  "listing_images_note": "rendered in Blender from the design-part OBJs (etsy_samples/r0N_*.py), NOT from the print file; re-render from print/ and register to pass G11",
  "blocker": "JLC CNC quotes need a STEP file; we only have mesh OBJ. Laser marking is a separate JLC finishing option to confirm."
 }
}